section,ipc,description_of_the_case,punishment,appropriate_steps,website_online
294,IPC,Addresses obscene acts and songs in public places that cause annoyance to others.,"Imprisonment of up to 3 months, or fine, or both.","Report to police, gather evidence, file an FIR. - Additional details provided for better guidance.",https://www.legalserviceindia.com/
354,IPC,Assault or use of criminal force against a woman with intent to outrage her modesty.,"Imprisonment of up to 2 years, or fine, or both.","File a police complaint, seek legal assistance, collect evidence. - Additional details provided for better guidance.",https://www.legalserviceindia.com/
354A,IPC,"Sexual harassment,harassed,I was harassed, including unwelcome physical contact, demands for sexual favors, and sexually colored remarks.","Rigorous imprisonment of up to 3 years, or fine, or both.","Report the harassment, seek legal action, approach women's helplines. - Additional details provided for better guidance.",https://www.legalserviceindia.com/
354B,IPC,Assault or use of criminal force with intent to disrobe a woman.,"Imprisonment of not less than 3 years, which may extend to 7 years, and fine.","Immediately report to police, seek legal protection. - Additional details provided for better guidance.",https://www.legalserviceindia.com/
354C,IPC,Voyeurism: Watching or capturing images of a woman engaged in a private act without her consent.,First conviction: imprisonment of 1 to 3 years and fine; Subsequent conviction: 3 to 7 years and fine.,"File an FIR, preserve evidence, approach cybercrime cell if digital. - Additional details provided for better guidance.",https://www.legalserviceindia.com/
354D,IPC,Stalking: Following a woman or monitoring her internet use without consent.,First offense: Up to 3 years imprisonment and fine; Subsequent offense: Up to 5 years and fine.,"Report to authorities, document incidents, seek restraining order if needed. - Additional details provided for better guidance.",https://www.legalserviceindia.com/
498A,IPC,"Cruelty by husband or relatives towards a married woman, including physical and mental harassment.",Imprisonment of up to 3 years and fine.,"Lodge a complaint with police or women’s cell, seek protection under domestic violence laws. - Additional details provided for better guidance.",https://www.legalserviceindia.com/
506,IPC,"Criminal intimidation: Threats to cause injury, reputation harm, or property damage.","Imprisonment of up to 2 years, or fine, or both.","File a complaint with police, seek legal action. - Additional details provided for better guidance.",https://www.legalserviceindia.com/
509,IPC,"Words, gestures, or acts intended to insult the modesty of a woman.","Imprisonment of up to 1 year, or fine, or both.","Report to authorities, gather evidence, file a formal complaint. - Additional details provided for better guidance.",https://www.legalserviceindia.com/
